"PISLPGPC","journalArticle","2024","Zhao, Tingcheng; He, Aibin; Khan, Mohammad Nauman; Yin, Qi; Song, Shaokun; Nie, Lixiao","Coupling of reduced inorganic fertilizer with plant-based organic fertilizer as a promising fertilizer management strategy for colored rice in tropical regions","Journal of Integrative Agriculture","","2095-3119","10.1016/j.jia.2023.04.035","","Colored rice is a type of high-quality, high-added-value rice that has attracted increasing attention in recent years. The use of large amounts of inorganic nitrogen fertilizer in rice fields results in low fertilizer use efficiency and high environmental pollution. Organic fertilizer is a promising way to improve soil quality and sustain high yields. However, most studies focus on the effect of animal-based organic fertilizers. The effects of different ratios of plantbased organic fertilizer and inorganic fertilizer on the grain yield and quality of colored rice have rarely been reported. Therefore, a two-year field experiment was conducted in 2020 and 2021 to study the effects of replacing inorganic N fertilizers with plant-based organic fertilizers on the yield, nitrogen use efficiency (NUE), and anthocyanin content of two colored rice varieties in a tropical region in China. The experimental treatments included no nitrogen fertilization (T1), 100% inorganic nitrogen fertilizer (T2), 30% inorganic nitrogen fertilizer substitution with plant-based organic fertilizer (T3), 60% inorganic nitrogen fertilizer substitution with plant-based organic fertilizer (T4), and 100% plantbased organic fertilizer (T5). The total nitrogen provided to all the treatments except T1 was the same at 120 kg ha-1. Our results showed that the T3 treatment enhanced the grain yield and anthocyanin content of colored rice by increasing nitrogen use efficiency compared with T2. On average, grain yields were increased by 9 and 8%, while the anthocyanin content increased by 16 and 10% in the two colored rice varieties under T3 across the two years, respectively, as compared with T2. Further study of the residual effect of partial substitution of inorganic fertilizers showed that the substitution of inorganic fertilizer with plant-based organic fertilizer improved the soil physiochemical properties, and thus increased the rice grain yield, in the subsequent seasons. The highest grain yield of the subsequent rice crop was observed under the T5 treatment. Our results suggested that the application of plantbased organic fertilizers can sustain the production of colored rice with high anthocyanin content in tropical regions, which is beneficial in reconciling the relationship between rice production and environmental protection.","2024-01","2025-08-27 10:53:06","2025-08-27 10:56:33","2024-02-27","93-107","","1","23","","J. Integr. Agric.","","","","","","","","en","","","","WOS:001163813800001","","","22 citations (Crossref/DOI) [2025-08-27]","","","","","","","","","","","","","","","","","","","","","","","","","","","","","","","","","","","","","","","","","","","","","","","","","","",""
"W2B68IZG","journalArticle","2025","Xia, Hanji; Liu, Hongguang; Gong, Ping; Li, Pengfei; Xu, Qiang; Zhang, Qian; Yang, Changkun; Meng, Qiang","Applying bio-organic fertilizer improved saline alkaline soil properties and cotton yield in xinjiang","Scientific Reports","","2045-2322","10.1038/s41598-025-97776-9","","Bio-organic fertilizers have demonstrated significant potential in enhancing saline-alkali soil properties, boosting crop yield, and reducing chemical fertilizer dependency. However, the extent of improvement and optimal application rates for varying saline-alkali soil conditions remain unclear. We conducted a 2-year field experiment (2022-2023) to evaluate the effects of different bio-organic fertilizer application rates on soil properties, nutrient availability, and cotton yield across three saline-alkali cotton fields with varying salinity levels 4.58, 9.07, and 12.76 g<middle dot>kg(-)(1) (T1-T3). Four treatments were implemented, involving chemical fertilizer reductions of 0% (CK), 20% (F1), 40% (F2), and 60% (F3). Results indicated that, compared to CK, bio-organic fertilizer application reduced soil bulk density, salinity, and pH by an average of 15.84%, 53.86%, and 7.5%, respectively. Concurrently, soil moisture content, organic matter, nitrogen, phosphorus, potassium, and cotton yield increased by 36.72%, 58.4%, 59.4%, 77.9%, 88.7%, and 50.32%, respectively. Notably, the improvements in soil properties and cotton yield were more pronounced in 2023 compared to 2022. Principal component analysis revealed that a 60% bio-organic fertilizer application rate was optimal for mild, moderate, and severely salinized cotton fields. These findings provide a scientific basis for reducing chemical fertilizer use while improving the productivity and sustainability of saline-alkali soils.","2025-04-17","2025-08-27 10:53:06","2025-08-27 10:56:20","2025-04-30","","","1","15","","Sci. Rep.","","","","","","","","en","","","","WOS:001470279200007","","","0 citations (Crossref/DOI) [2025-08-27]","","","","","","","","","","","","","","","","","","","","","","","","","","","","","","","","","","","","","","","","","","","","","","","","","","",""
"XTGYAW45","journalArticle","2023","Zhou, Nannan; Jiang, Tengfei; Wang, Jiajia; Chen, Yujiao; Yang, Wenbin; Tang, Shan; Han, Shang; Wang, Ying","Optimizing the incorporated amount of chinese milk vetch (astragalus sinicus L.) to improve rice productivity without increasing CH4 and N2O emissions","Agronomy-basel","","2073-4395","10.3390/agronomy13061636","","Chinese milk vetch (CMV) is a leguminous green manure that is commonly cultivated in paddy fields and can partially substitute synthetic nitrogen fertilizer. However, the impacts of incorporating CMV on CH4 and N2O emissions are still a subject of controversy. Therefore, we conducted a field experiment over three years to investigate emissions under different substitution ratios: urea only (CF); incorporating a traditional amount of CMV (MV); and with incorporation ratios of 1/3 (MV1/3), 2/3 (MV2/3), and 4/3 (MV4/3) of MV for partial urea substitution. Compared with CF, MV2/3, MV, and MV 4/3 resulted in increased yields. MV and MV4/3 reduced N2O emissions but increased CH4 emissions by 28.61% and 85.60% (2019), 32.38% and 103.19% (2020), and 28.86% and 102.98% (2021), respectively, resulting in an overall increase in total global warming potential (except for MV in 2021). MV2/3 exhibited a low greenhouse gas intensity value ranging from 0.46 to 0.47. Partial least-squares-path model results showed that CH4 and N2O emissions were influenced by substitution ratios, which indirectly regulated the gene abundances of mcrA and nosZ. Overall, the impact of CMV on CH4 and N2O emissions was determined by substitution ratios. MV2/3, which involved partial substitution of synthetic N fertilizer with 15.0 t ha(-1) of CMV, resulted in improved rice productivity without increasing CH4 and N2O emissions, making it a recommended approach in the study area.","2023-06","2025-08-27 10:53:06","2025-08-27 10:58:07","2023-07-07","","","6","13","","Agron.-basel","","","","","","","","en","","","","WOS:001016851900001","","","5 citations (Crossref/DOI) [2025-08-27]","","","","","","","","","","","","","","","","","","","","","","","","","","","","","","","","","","","","","","","","","","","","","","","","","","",""
"TF39884K","journalArticle","2022","Zhao, Hui-Li; Guo, Xiao-Hong; Song, Bing; Tian, Xiao-Hong; Zhao, Ying; Wu, Nan","Distribution of soil organic carbon and nitrogen under reduced nitrogen application in the guanzhong plain of China","Journal of Plant Nutrition and Soil Science","","1436-8730","10.1002/jpln.202100062","","Background The problems of soil quality degradation and environmental pollution caused by excessive use of nitrogen fertilizer seriously affect sustainable development of agriculture. Aims We investigated the effects of reduced nitrogen application with simultaneous full straw return on carbon input, aggregate size distribution, aggregate-associated organic carbon and total nitrogen (TN), soil organic carbon (SOC) stock, SOC fractions, and crop yield. Methods A long-term field experiment was performed in the dryland region of Guanzhong. The study involved three nitrogen fertilizer (NF) amounts: 337.5 (conventional NF, CNF), 286.4 (15%NF reduction, 15%RNF), and 236.3 (30%NF reduction, 30%RNF) kg N ha(-1) y(-1) with full straw return. Results Compared with CNF, 30%RNF increased the content of soil organic carbon by 5.7% and increased maize yield by 13.1%, under straw return conditions. The 30%RNF + straw application treatment promoted the formation of large macro-aggregates more effectively than CNF application. The 30%RNF + straw treatment significantly increased SOC by 10.6% and 4.7%, respectively, in large and small macroaggregates relative to conventional NF. Moreover, the 30%RNF + straw treatment resulted in a significant increase in the SOC content in the density fractions of mineral soil organic matter (mSOM) for both small and large macro-aggregates. This treatment also resulted in a significant increase in the content of TN in the mSOM and density fractions of particulate matter that had coarse and fine intra-aggregates of the large macro-aggregates. Conclusion Full straw return with reduced nitrogen (N) application could be a promising option to improve the structure of soil aggregates, soil organic carbon, and nitrogen sequestration.","2022-02","2025-08-27 10:53:06","2025-08-27 10:56:35","2021-11-26","87-97","","1","185","","J. Plant Nutr. Soil Sci.","","","","","","","","en","","","","WOS:000720780100001","","","4 citations (Crossref/DOI) [2025-08-27]","","","","","","","","","","","","","","","","","","","","","","","","","","","","","","","","","","","","","","","","","","","","","","","","","","",""
"ISIIUS5N","journalArticle","2023","Han, Jiale; Jin, Xiangle; Huang, Shiwei; Zhu, Xinyu; Liu, Jiaojiao; Chen, Jiayong; Zhang, Afeng; Wang, Xudong; Tong, Yanan; Hussain, Qaiser; Feng, Hao","Carbon and nitrogen footprints of apple orchards in China's loess plateau under different fertilization regimes","Journal of Cleaner Production","","0959-6526","10.1016/j.jclepro.2023.137546","","To comprehensively understand the effects of different fertilization regimes on carbon sequestration and greenhouse gas (GHG) emissions in apple orchard production systems, we assessed the carbon (C) emissions and nitrogen (N) losses along with the life cycle assessment (LCA) to quantify the carbon footprint (CF) and nitrogen footprint (NF) under different fertilization regimes in the Loess Plateau, China. The field experiment was comprising four N fertilizer regimes such as i) single inorganic fertilizer with 800 kg N ha-1 (N800); ii) single inorganic fertilizer with 400 kg N ha-1 (N400); iii) inorganic and organic fertilizers each with 200 kg N ha-1 (N200+O200) as well as without N fertilizer treatment as control (CK). Data regarding the soil organic carbon (SOC), nitrate N (NO3--N), ammonium N (NH4+-N) and emissions of carbon oxide (CO2) and nitrous oxide (N2O) were measured. Organic fertilizer substitution (OFS) boosted SOC while decreased NO3 --N and NH4+-N concentrations. The cumulative CO2 emissions and emission factors (EFs) of N2O did not change significantly amongst fertilization strategies; however, as compared to N800, N400 and N200+O200 significantly reduced N2O emissions by 41.8%-45.7% and 43.5%-46.6% respectively. The NF was dominated by N residues (73.0%- 97.4%) and organic fertilizer (24.37%), with a significant difference detected between N400 and N200+N200 treatments. Meanwhile, compared to inorganic plots, OFS significantly reduced CF (345.9%-368.0%), which was influenced by SOC sequestration. The CF from N plots in apple orchard was dominated by fertilizer (21.7%- 39.6%), pesticides (4.3%-6.2%) and N2O (5.6%-11.8%). In addition, our results were further supported by a meta-analysis with 22 published studies, which showed that organic fertilizer and chemical fertilizer + organic fertilizer significantly reduced regional CF by 388.8% and 78.2%, respectively. However, regional NF ranged from 441.4 kg N-eq ha-1 to 453.9 kg N-eq ha-1, with no significant difference between fertilizer strategies. Therefore, reducing the amount of N fertilizer and partial OFS is a viable long-term strategy for mitigating climate change through C sequestration, reduction of N residues, and GHG mitigation, which could be beneficial to low C apple production in the Loess Plateau, China.","2023-08-10","2025-08-27 10:53:06","2025-08-27 10:56:25","2023-07-01","","","","413","","J. Cleaner Prod.","","","","","","","","en","","","","WOS:001011042700001","","","19 citations (Crossref/DOI) [2025-08-27]","","","","","","","","","","","","","","","","","","","","","","","","","","","","","","","","","","","","","","","","","","","","","","","","","","",""
"C3NUSTFE","journalArticle","2020","Li, Zengqiang; Zhang, Xian; Xu, Jing; Cao, Kai; Wang, Jianhong; Xu, Changxu; Cao, Weidong","Green manure incorporation with reductions in chemical fertilizer inputs improves rice yield and soil organic matter accumulation","Journal of Soils and Sediments","","1439-0108","10.1007/s11368-020-02622-2","","Purpose A 6-year (2011-2016) field experiment was performed to explore the effects of partial substitution of chemical fertilizer by green manure on rice yield, sustainability yield index, and the building-up of different fractions of soil organic carbon, soil nitrogen, and phosphorus. Materials and methods The experiment included no fertilization (NF), chemical fertilizer only (CF100), and Chinese milk vetch (Astragalus sinicus L.) incorporation with 80%, 60%, 40%, 20%, and 0% of total N, P, and K supplied from chemical fertilizer (MVCF80, MVCF60, MVCF40, MVCF20, and MVCF0, respectively) treatments. The soil organic carbon fractions, soil nitrogen, and phosphorus fraction contents were measured over 6 years. Results and discussion In comparison with CF100 treatment, the MVCF80, MVCF60, and MVCF40 treatments significantly increased rice yield between 2013 and 2016, thus improving sustainability yield index. The soil organic carbon fractions increased 15-58%, 16-61%, 14-50%, and 12-33% in the MVCF80, MVCF60, MVCF40, and MVCF20 treatments, respectively, compared with the CF100 treatment (p < 0.05). The easily oxidizable nitrogen, acid hydrolysable pool II nitrogen, total nitrogen, NaOH extractable phosphorus, HCl extractable phosphorus, and total phosphorus contents in the MVCF40 treatment were 17%, 28%, 9%, 12%, 15%, and 8% higher than those in the CF100 treatment (p < 0.05). The MVCF60 and MVCF80 treatments further increased the contents of these nitrogen and phosphorus fractions compared with the CF100 treatment. Stepwise multiple linear regression analysis showed that the average yield was positively influenced by the contents of total phosphorus, easily oxidizable nitrogen, and dissolved organic nitrogen, and that the sustainability yield index was positively influenced by the contents of easily oxidizable carbon and total organic carbon. Conclusions Chinese milk vetch incorporation with a 20-40% reduction in chemical fertilizer inputs may be a potential fertilization practice for improving rice productivity and sustainability.","2020-07","2025-08-27 10:53:06","2025-08-27 10:59:18","2020-05-08","2784-2793","","7","20","","J. Soils Sediments","","","","","","","","en","","","","WOS:000528435700001","","","40 citations (Crossref/DOI) [2025-08-27]","","","","","","","","","","","","","","","","","","","","","","","","","","","","","","","","","","","","","","","","","","","","","","","","","","",""
"VMZNK97Y","journalArticle","2024","Gao, Yi; Wang, Jiarui; Ge, Yihong; Lei, Yunhui; Wei, Xiaocheng; Xu, Yan; Zheng, Xiangqun","Partial substitution of nitrogen fertilizers by organic products of rural waste co-composting impacts on farmland soil quality","Environmental Technology & Innovation","","2352-1864","10.1016/j.eti.2023.103470","","Substituting nitrogen fertilizers with organic fertilizer is considered as an important measure to address agricultural non-point source pollution. However, little is known about the impact on soil environment of rural multi-source waste compost products to substitute nitrogen fertilizers. Here we examined the response of soil quality to the alternative application of organic products which previously made from co-compost of swine manure, human excrement and rice straw. According to the soil quality evaluation model, we observed that compost product application improved soil quality, wherein 40% compost product instead of nitrogen fertilizer showed a best effect on promoting soil quality. This was strongly related to microbial diversity and their network complexity. Also, compost product application shifted the composition of bacterial and fungal communities, significantly increasing relative abundances of dominant bacteria phyla (e.g. Proteobacteria, Actinobacteriota and Gemmatimonadota) and fungal phyla (e.g. Ascomycota), which indicated that compost product application facilitate the growth of microorganisms eutrophic taxa of microorganisms. Collectively, this study gives an optimal solution to replace nitrogen fertilizers by co-composted organic product and provides a deeper understanding of the impact of rural waste co-composted product on agricultural soils along with their value for agricultural utilization.","2024-02","2025-08-27 10:53:06","2025-08-27 10:57:56","2024-02-26","","","","33","","Environ. Technol. Innovation","","","","","","","","en","","","","WOS:001157243100001","","","13 citations (Crossref/DOI) [2025-08-27]","","","","","","","","","","","","","","","","","","","","","","","","","","","","","","","","","","","","","","","","","","","","","","","","","","",""
"7URF39FU","journalArticle","2020","Huang, Rong; Wang, Yingyan; Gao, Xuesong; Liu, Jiang; Wang, Zifang; Gao, Ming","Nitrous oxide emission and the related denitrifier community: a short-term response to organic manure substituting chemical fertilizer","Ecotoxicology and Environmental Safety","","0147-6513","10.1016/j.ecoenv.2020.110291","","Partially substituting chemical fertilizer with organic manure can aid in the disposal of agricultural wastes via recycling into agricultural land, reduce chemical fertilizer application, and influence nitrogen (N) transformation. However, relatively few studies have investigated the association between soil physicochemical properties, denitrifier communities and N2O emission after short-term substitution of organic manure in vegetable fields. We conducted a short-term vegetable field experiment which included one control treatment (CT, no fertilizer) and three fertilization treatments containing equal amount of total N, phosphorus and potassium (CF, chemical fertilizer only; CMR, chemical fertilizer plus mushroom residue; COM, chemical fertilizer plus cattle manure). The results showed that partial substitution of chemical fertilizer with organic manure greatly increased cumulative N2O emissions, N2O emission factors and yield-scaled N2O emissions by 122-203%, 238-600% and 128-181%, respectively. Compared with the CF treatment, short-term substitution with organic manure reduced the abundance of nirS- and nosZ-type denitrifiers, and increased that of nirK-type denitrifiers. Modeling indicated that nirS abundance, together with soil available N, NIR activity, nirK abundance, SOC, NH4+, and NO3- were the primary factors associated with cumulative N2O emissions. The denitrifier community composition of the CFtreated soil was separated from that of soils treated with CMR and COM, and was primarily influenced by soil NH4+ concentration. NIR activity showed a significant correlation with denitrifier community composition. Overall, short-term substitution of chemical fertilizer with cattle manure (lower C/N ratio) reduced the abundance of nirS- and nosZ-type denitrifiers, but stimulated N2O emission.","2020-04-01","2025-08-27 10:53:06","2025-08-27 10:59:19","2020-03-24","","","","192","","Ecotoxicol. Environ. Saf.","","","","","","","","en","","","","WOS:000518502300035","","","33 citations (Crossref/DOI) [2025-08-27]","","","","","","","","","","","","","","","","","","","","","","","","","","","","","","","","","","","","","","","","","","","","","","","","","","",""
"RU9GDMF4","journalArticle","2025","Li, Peipei; Shang, Yuanyi; Li, Hui; Li, Fang; Wang, Yi; Zhu, Xueqiang; Li, Shiying; Wang, Xiaolin; Han, Yanlai","Optimizing straw and manure Co-substitution regimes to maintain stable crop yields through enhanced soil stoichiometric balance","Agriculture-basel","","2077-0472","10.3390/agriculture15040429","","The benefits of partially substituting inorganic fertilizers with organic fertilizers have been extensively acknowledged. However, the key mechanisms behind nutrient transformation and supply for stable crop yields are still not fully understood. Based on an 11-year field experiment with a wheat-maize rotation system, this study explored the advantages of combined straw and manure substitution under various organic substitution regimes. These regimes included an unfertilized control (CK), inorganic nitrogen, phosphorus, and potassium fertilizers (NPK), NPK substituted with straw (NPKS), NPK substituted with manure (NPKM), and NPK substituted with both straw and manure (NPKSM). Compared to NPK and NPKS, NPKM and NPKSM significantly improved wheat yield by 12.8% and 13.8%, respectively. Bulk soil organic carbon (SOC), total nitrogen (TN), available superphosphate (AP), beta-glucosidase (beta G), urease (URE), and alkaline phosphatase (ALP) were all higher in the NPKM treatment than in the NPKSM treatment. However, compared to NPKM, NPKSM significantly decreased the potential nitrification rate by 31.0% and increased the soil NH4+-N content. Correspondingly, the functional genes of nitrification were also found to be decreased in the NPKSM treatment. In the rhizosphere, most soil factors increased compared to bulk soil, but treatment differences were smaller. However, the differences among treatments were reduced in the rhizosphere. The high amount of manure applied in the NPKM treatment caused excessive soil phosphorus accumulation, reaching over 46.7 mg/kg, resulting in lower N/P and C/P ratios. The soil quality index (SQI), based on soil nutrients, enzymes, functional genes, and C:N:P stoichiometry, was 9.9% higher in NPKSM than in NPKM. Bulk soil SQIs showed stronger correlations with wheat yields than rhizosphere SQIs, highlighting that bulk soil was superior to rhizosphere in predicting crop yield. Partial least squares path modeling showed that C/N, N/P, and C/P ratios strongly influenced SQIs. The NPKSM treatment, which improved soil nutrients, biological factors, and balanced C:N:P stoichiometry, is an effective strategy for sustainable agriculture. Future practices should focus on maintaining stoichiometric balance to sustain soil quality and crop yields.","2025-02","2025-08-27 10:53:06","2025-08-27 10:57:38","2025-03-03","","","4","15","","Agric.-basel","","","","","","","","en","","","","WOS:001429928900001","","","0 citations (Crossref/DOI) [2025-08-27]","","","","","","","","","","","","","","","","","","","","","","","","","","","","","","","","","","","","","","","","","","","","","","","","","","",""
