"9A2KU8WK","journalArticle","2007","Meijide, Ana; Diez, Jose A.; Sanchez-Martin, Laura; Lopez-Fernandez, Susana; Vallejo, Antonio","Nitrogen oxide emissions from an irrigated maize crop amended with treated pig slurries and composts in a Mediterranean climate","Agriculture Ecosystems and Environment","","0167-8809","10.1016/j.agee.2006.11.020","","Organic fertilizers may differ greatly in composition and as a result there may also be differences in nitrogen oxides emissions following their application to soils. The aim of this study was to evaluate the influence of mineral and organic N fertilizers on the nitrification and denitrification processes, and consequently on N2O and NO emissions. Therefore, a field experiment was carried out on an irrigated sandy loam soil under Mediterranean conditions during the maize (Zea mays L.) growing season. Untreated pig slurry (UPS) both with and without the nitrification inhibitor dicyandiamide (UPS + DCD), digested thin pig slurry fraction (DTP), composted solid fraction of slurry mixed with urea (CPS + U) and composted municipal solid waste mixed with urea (MSW + U) were applied at a rate of 175 kg available N ha(-1). Their emissions were compared with those from urea (U) and a control treatment to which no nitrogen fertilization was administered (Control). Accumulated nitrous oxide losses during the crop season ranged from 6.0 to 9.3 kg N2O-N ha(-1) for the Control and CPS + U, respectively, whereas nitric oxide losses ranged from 0.01 to 0.23 kg NO-N ha(-1), for the Control and U, respectively. The use of digested slurries mitigated N2O emission by 25% in relation to untreated pig slurry, but NO emissions were similar for both treatments. Dicyandiamide reduced N2O and NO emissions by 64 and 78% with respect to slurry without the inhibitor. An indirect effect of DCD on denitrification was also observed, with a reduction of 32% in denitrification with respect to the slurry without the inhibitor. In this case, the greatest reduction in denitrification losses occurred during the irrigation period. Composts mixed with urea reduced NO emissions by 56% (CPS + U) and 85% (MSW + U) in relation to the urea treatment, but its effect on N2O depended on the type of compost involved: CPS + U increased NO emission by 27%, whereas MSW + U reduced it by 55% in relation to urea. Denitrification was the most important process responsible for N2O emissions when organic fertilizers were applied to the soil, while nitrification was the most important for the inorganic fertilizer. The C:N ratio of fertilizers was a good predictor of their NO emissions, denitrification losses and N2O/N-2 ratio. On the other hand, added soluble N was a good predictor for cumulative N2O emissions during the period before irrigation. This work shows that an appropriate selection of organic fertilizers based on their composition could be used to mitigate emissions of the atmospheric pollutants NO and NO in comparison with urea. (c) 2006 Elsevier B.V. All rights reserved.","2007-08","2025-08-27 10:53:08","2025-08-27 11:00:04","2007-08-01","383-394","","4","121","","Agric. Ecosyst. Environ.","","","","","","","","en","","","","WOS:000245845600010","","","173 citations (Crossref/DOI) [2025-08-27]","","","","","","","","","","","","","","","","","","","","","","","","","","","","","","","","","","","","","","","","","","","","","","","","","","",""
"2WVRZPM6","journalArticle","2024","Liang, Shuo; Sun, Nan; Longdoz, Bernard; Meersmans, Jeroen; Ma, Xingzhu; Gao, Hongjun; Zhang, Xubo; Qiao, Lei; Colinet, Gilles; Xu, Minggang; Wu, Lianhai","Both yields of maize and soybean and soil carbon sequestration in typical mollisols cropland decrease under future climate change: SPACSYS simulation","Frontiers in Sustainable Food Systems","","2571-581X","10.3389/fsufs.2024.1332483","","Although Mollisols are renowned for their fertility and high-productivity, high carbon (C) losses pose a substantial challenge to the sustainable provision of ecosystem services, including food security and climate regulation. Protecting these soils with a specific focus on revitalizing their C sequestration potential emerges as a crucial measure to address various threats associated with climate change. In this study, we employed a modeling approach to assess the impact of different fertilization strategies on crop yield, soil organic carbon (SOC) stock, and C sequestration efficiency (CSE) under various climate change scenarios (baseline, RCP 2.6, RCP 4.5, and RCP 8.5). The process-based SPACSYS model was calibrated and validated using data from two representative Mollisol long-term experiments in Northeast China, including three crops (wheat, maize and soyabean) and four fertilizations (no-fertilizer (CK), mineral nitrogen, phosphorus and potassium (NPK), manure only (M), and chemical fertilizers plus M (NPKM or NM)). SPACSYS effectively simulated crop yields and the dynamics of SOC stock. According to SPACSYS projections, climate change, especially the increased temperature, is anticipated to reduce maize yield by an average of 14.5% in Harbin and 13.3% in Gongzhuling, and soybean yield by an average of 10.6%, across all the treatments and climatic scenarios. Conversely, a slight but not statistically significant average yield increase of 2.5% was predicted for spring wheat. SOC stock showed a decrease of 8.2% for Harbin and 7.6% for Gonghzuling by 2,100 under the RCP scenarios. Future climates also led to a reduction in CSE by an average of 6.0% in Harbin (except NPK) and 13.4% in Gongzhuling. In addition, the higher average crop yields, annual SOC stocks, and annual CSE (10.15-15.16%) were found when manure amendments were performed under all climate scenarios compared with the chemical fertilization. Soil CSE displayed an exponential decrease with the C accumulated input, asymptotically approaching a constant. Importantly, the CSE asymptote associated with manure application was higher than that of other treatments. Our findings emphasize the consequences of climate change on crop yields, SOC stock, and CSE in the Mollisol regions, identifying manure application as a targeted fertilizer practice for effective climate change mitigation.","2024-04-02","2025-08-27 10:53:08","2025-08-27 10:56:23","2024-04-20","","","","8","","Front. Sustainable Food Syst.","","","","","","","","en","","","","WOS:001203136200001","","","1 citations (Crossref/DOI) [2025-08-27]","","","","","","","","","","","","","","","","","","","","","","","","","","","","","","","","","","","","","","","","","","","","","","","","","","",""
"FIPZUF6C","journalArticle","2024","He, W. Q.; Fan, Y. F.; Hang, X. F.; Xiang, T. Y.","Effects of biogas slurry as the replacement for chemical fertilizers on chinese cabbage yield and soil quality","Applied Ecology and Environmental Research","","1589-1623","10.15666/aeer/2203_23592366","","To clarify the impact of biogas slurry replacing chemical fertilizers on Chinese cabbage yield and soil quality, we conducted two consecutive years of field experiment. The purified chemical fertilizer treatment was set as the control, while an equivalent nitrogen amount was added to the biogas slurry treatment (453 kg N<middle dot>hm(-2)<middle dot>a(-1)) to investigate its influence on soil nutrient indicators, heavy metals, and Chinese cabbage yield. The results indicated that compared to the chemical fertilizer treatment, the biogas slurry treatment increased soil organic matter, total nitrogen, and organic nitrogen contents by 16.4%, 35.0%, and 26.3%, respectively. The biogas slurry treatment led to decreases of Cr, Ni, Cu, Zn, As, Cd, Pb, and Hg content by 12.6%, 14.6%, 9.25%, 32.2%, 30.1%, 12.1%, 24.0%, and 61.5%, respectively. Additionally, the Chinese cabbage yield increased by 10.0% in the biogas slurry treatment group. The study suggests that biogas slurry replacing chemical fertilizers can not only increase soil fertility and Chinese cabbage yield but also contribute to the improvement of the environmental quality of soils. However, more experiments aiming to provide references for the application of the optimal dosage of biogas slurry for optimal Chinese cabbage production are needed.","2024","2025-08-27 10:53:08","2025-08-27 10:56:44","2024-05-14","2359-2366","","3","22","","Appl. Ecol. Environ. Res.","","","","","","","","en","","","","WOS:001215994000001","","","2 citations (Crossref/DOI) [2025-08-27]","","","","","","","","","","","","","","","","","","","","","","","","","","","","","","","","","","","","","","","","","","","","","","","","","","",""
"DLPKN7ZG","journalArticle","2024","Nartey, Obemah David; Liu, Deyan; Luo, Jiafa; Lindsey, Stuart; Chen, Zengming; Yuan, Junji; Zaman, Mohammad; Hogarh, Jonathan Nartey; Ding, Weixin","Optimizing application of dairy effluent with synthetic N fertilizer reduced nitrogen leaching in clay loam soil","Heliyon","","2405-8440","10.1016/j.heliyon.2024.e33900","","High application rates of dairy effluent and manure are often associated with nitrogen (N) leaching, which can affect groundwater quality. Here, we used a lysimeter to examine N leaching losses and biomass yield following application of dairy effluent and manure under wheat-maize cropping. The field experiment included seven treatments: no N fertilizer (Control); 200/300 kg N ha(-1) synthetic N fertilizer only (wheat/maize) (CN); 100/150 kg N ha(-1) synthetic N fertilizer plus 100/150 (DE1), 150/200 (DE2) and 250/350 (DE3) kg N ha(-1) dairy effluent; 100/150 kg N ha(-1) synthetic fertilizer plus 100/150 kg N ha(-1) dairy manure (SM1); and 150/225 kg N ha(-1) synthetic fertilizer plus 50/75 kg N ha(-1) dairy manure (SM2). Compared with CN, DE1 treatment increased maize yield by 10.0 %, wheat N use efficiency (NUE) by 26.5 %, and wheat and maize N uptake by 7.7-16.3 %, while reduced N leaching by 22.4 % in wheat season and by 40.4 % in the maize season. In contrast, DE2 and DE3 treatment increased N leaching by 27.2-241 % and reduced NUE by 26.2-55.2 %. SM2 treatment increased yield and NUE by 8.8 % and 7.8 %, respectively, and reduced N leaching by 42.9 % during the wheat but not the maize season. Annual N leaching losses were 37.6 kg N ha(-1) under CN treatment, but decreased to 27.4 kg N ha(-1) under DE1. In contrast, N leaching increased to 52.8 and 84.1 kg N ha(-1) under DE2 and DE3 treatment, respectively (P < 0.05). Meanwhile, under SM1 and SM2 treatment, N leaching decreased by 71.2 % and 32.0 %, respectively, compared with CN. These results suggest that replacing 50 % and 25 % synthetic N fertilizer with dairy farm effluent and manure could reduce N leaching losses but had varied effects on crop productivity under wheat-maize cropping.","2024-07-15","2025-08-27 10:53:08","2025-08-27 10:57:51","2024-07-16","","","13","10","","Heliyon","","","","","","","","en","","","","WOS:001265868300001","","","1 citations (Crossref/DOI) [2025-08-27]","","","","","","","","","","","","","","","","","","","","","","","","","","","","","","","","","","","","","","","","","","","","","","","","","","",""
"BERADQFR","journalArticle","2020","Luan Hao-an; Gao Wei; Tang Ji-wei; Li Ruo-nan; Li Ming-yue; Zhang Huai-zhi; Chen Xin-ping; Masiliunas, Dainius; Huang Shao-wen","Aggregate-associated changes in nutrient properties, microbial community and functions in a greenhouse vegetable field based on an eight-year fertilization experiment of China","Journal of Integrative Agriculture","","2095-3119","10.1016/S2095-3119(20)63269-5","","Soil aggregation, microbial community, and functions (i.e., extracellular enzyme activities; EEAs) are critical factors affecting soil C dynamics and nutrient cycling. We assessed soil aggregate distribution, stability, nutrients, and microbial characteristics within >2, 0.25-2, 0.053-0.25, and <0.053 mm aggregates, based on an eight-year field experiment in a greenhouse vegetable field in China. The field experiment includes four treatments: 100% N fertilizer (CF), 50% substitution of N fertilizer with manure (M), straw (S), and manure plus straw (MS). The amounts of nutrient (N, P2O5, and K2O) input were equal in each treatment. Results showed higher values of mean weight diameter in organic-amended soils (M, MS, and S, 2.43-2.97) vs. CF-amended soils (1.99). Relative to CF treatment, organic amendments had positive effects on nutrient (i.e., available N, P, and soil organic C (SOC)) conditions, microbial (e.g., bacterial and fungal) growth, and EEAs in the >0.053 mm aggregates, but not in the <0.053 mm aggregates. The 0.25-0.053 mm aggregates exhibited better nutrient conditions and hydrolytic activity, while the <0.053 mm aggregates had poor nutrient conditions and higher oxidative activity among aggregates, per SOC, available N, available P, and a series of enzyme activities. These results indicated that the 0.25-0.053 mm (<0.053 mm) aggregates provide suitable microhabitats for hydrolytic (oxidative) activity. Interestingly, we found that hydrolytic and oxidative activities were mainly impacted by fertilization (58.5%, P<0.01) and aggregate fractions (50.5%, P<0.01), respectively. The hydrolytic and oxidative activities were significantly (P<0.01) associated with nutrients (SOC and available N) and pH, electrical conductivity, respectively. Furthermore, SOC, available N, and available P closely (P<0.05) affected microbial communities within >0.25, 0.25-0.053, and <0.053 mm aggregates, respectively. These findings provide several insights into microbial characteristics within aggregates under different fertilization modes in the greenhouse vegetable production system in China.","2020-10","2025-08-27 10:53:08","2025-08-27 10:56:18","2020-10-06","2530-2548","","10","19","","J. Integr. Agric.","","","","","","","","en","","","","WOS:000572249100004","","","24 citations (Crossref/DOI) [2025-08-27]","","","","","","","","","","","","","","","","","","","","","","","","","","","","","","","","","","","","","","","","","","","","","","","","","","",""
"MLLDSMGB","journalArticle","2023","Zhang, Jianglin; Nie, Jun; Cao, Weidong; Gao, Yajie; Lu, Yanhong; Liao, Yulin","Long-term green manuring to substitute partial chemical fertilizer simultaneously improving crop productivity and soil quality in a double-rice cropping system","European Journal of Agronomy","","1161-0301","10.1016/j.eja.2022.126641","","Rotation with Chinese milk vetch (MV) as winter green manure in double-rice cropping system is an efficient approach to substitute chemical fertilizer (CF). However, the optimal substitution rate of MV for CF and its long-term effects on crop productivity and soil quality remain unknown. We conducted a 13-year field experiment with different substitution rates of MV for CF (22.5 t ha(-1) fresh MV incorporation with 100%, 80%, 60%, and 40% of the recommended nitrogen (N) and potassium (K) supply, represented by MV+F-100, MV+F-80, MV+F-60 and MV+F-40, respectively) to investigate its long-term effects on yield sustainability and soil quality in double rice cropping system. Compared with the sole application of CF, the MV+F-100 and MV+F-80 treatments signifi-cantly increased the early rice yields by 15.6% and 11.3% and the late rice yields by 9.3% and 6.3%, respectively. Utilization of MV to substitute 0-40% of the N and K in early rice season and 0-20% of the N and K in late rice season significantly increased the soil quality index (SQI). However, further increasing the substitution rate decreased the sustainability yield index (SYI) and SQI. The soil available phosphorus had a stronger effect on the early and late rice grain yield than the other soil physicochemical properties. Meanwhile, rice grain yields significantly increased with increasing SQI, and the apparent N, P and K balances positively affects SQI. The SYIs of early and late rice crops linearly increased with increasing SQIs, while the coefficient of variance in grain yield (CVy) decreased with increasing SQI. Consequently, long-term utilization of MV to substitute 0-40% of the N and K in early rice season and 0-20% of the N and K in late rice season can simultaneously improves yield sus-tainability and soil quality.","2023-01","2025-08-27 10:53:08","2025-08-27 10:58:08","2022-11-13","","","","142","","Eur. J. Agron.","","","","","","","","en","","","","WOS:000876352700008","","","78 citations (Crossref/DOI) [2025-08-27]","","","","","","","","","","","","","","","","","","","","","","","","","","","","","","","","","","","","","","","","","","","","","","","","","","",""
"VTUK8VKK","journalArticle","2023","Li, Hanting; Fan, Zhilong; Wang, Qiming; Wang, Guocui; Yin, Wen; Zhao, Cai; Yu, Aizhong; Cao, Weidong; Chai, Qiang; Hu, Falong","Green manure and maize intercropping with reduced chemical N enhances productivity and carbon mitigation of farmland in arid areas","European Journal of Agronomy","","1161-0301","10.1016/j.eja.2023.126788","","Keeping high productivity and low soil carbon emission (CE) while reducing chemical fertilizer is a significant challenge for crop production in developing modern agriculture. A field experiment was conducted to evaluate the effect of intercropping green manure with reduced N on maize productivity and carbon mitigation in northwestern China. The field experiment used a split-plot design with three replicates. Three cropping patterns were maize-common vetch intercropping (M/V), maize-rape intercropping (M/R), and sole maize (M). Two N fertilizer rates formed the subplots: the conventional N rate was reduced by 25% (N1: 270 kg ha-1) and the conventional N rate (N2: 360 kg ha-1). The compensation effect (TCE, %) was used to quantify the degree of recovery of intercropping green manure on maize grain yield (GY) under N reduction. It was shown by the results that the negative effect of N reduction on maize GY was compensated by intercropping green manure. Maize-common vetch intercropping integrated with N reduction (M/VN1) had a more substantial compensation ef-fect (TCE) with the planting years lengthening, and TCE was 1.0%, 0.9%, 4.1%, and 4.9% in 2018, 2019, 2020, and 2021, respectively. The CE of the cropping system was decreased by intercropping green manure compared to sole maize. The CE in the intercropping system was further decreased by N reduction, and the CE of M/RN1 and M/VN1 was decreased by 27.7% and 32.1%, respectively, compared to MN2 (i.e., the control). Finally, the CE of the intercropping system was decreased by M/VN1 by 6.5% compared to M/RN1 in 2019-2021. We used the ratio of net primary productivity to carbon emission (NPP/CE) to determine soil C sequestration (CS) potential. Intercropping green manure with N reduction in enhancing soil CS mainly occurred in the late growth period of maize. Over the four years of study, the ratios of NPP/CE for M/RN1 and M/VN1 were 23.3% and 32.9%, respectively, greater than that of MN2; also, it of M/VN1 was increased by 8.9% compared to M/RN1 in 2019-2021. M/VN1 had great potential for enhancing soil CS. Thus, adding green manure as an intercropping component in the maize cropping system while reducing chemical N fertilizer is a promising system to enhance maize productivity and carbon mitigation in the farmlands of arid areas.","2023-04","2025-08-27 10:53:08","2025-08-27 10:57:09","2023-04-11","","","","145","","Eur. J. Agron.","","","","","","","","en","","","","WOS:000957103900001","","","18 citations (Crossref/DOI) [2025-08-27]","","","","","","","","","","","","","","","","","","","","","","","","","","","","","","","","","","","","","","","","","","","","","","","","","","",""
"KZLRZ682","journalArticle","2022","Liang, Zhenghao; Jin, Xin; Zhai, Pengfei; Zhao, Yan; Cai, Jinwen; Li, Shoupeng; Yang, Shuyun; Li, Changzhen; Li, Changjiang","Combination of organic fertilizer and slow-release fertilizer increases pineapple yields, agronomic efficiency and reduces greenhouse gas emissions under reduced fertilization conditions in tropical areas","Journal of Cleaner Production","","0959-6526","10.1016/j.jclepro.2022.131054","","To ensure pineapple productivity, large amounts of chemical fertilizer are used in the tropics of China. However, the high temperatures, rainfall and low fertilizer utilization efficiencies lead to fertilizer leaching loss and greenhouse gas emissions, which are very unfavourable to the sustainable production of pineapple. The purpose of this study was to determine whether reducing fertilizer applications could increase pineapple yield, quality and agronomic efficiency and reduce the global warming potential. A 4-year field experiment with five fertilization pattern treatments (e.g., CK: no fertilization; NPK: traditional fertilization; INF: reduced nitrogen (N), phosphorus and potassium fertilizers; INF + M: based on INF, 20% N was replaced by organic fertilizer; INF + M + S: based on INF, 20% and 15% N were replaced by organic and slow-release fertilizers, respectively) was established to ascertain the potential role of reduced fertilization levels in increasing pineapple yield, quality and agronomic efficiency and reducing greenhouse gas emissions. The results revealed that compared with the NPK treatment, the INF, INF + M and INF + M + S treatments increased pineapple yields by 8.1%, 13.0% and 27.1% averaged over the two seasons, respectively, and significantly improved the agronomic efficiency and reduced the global warming potential and greenhouse gas emission intensity without compromising quality. In addition, when compared with INF treatment, the INF + M and INF + M + S treatments could significantly reduce the nitrous oxide and carbon dioxide emissions and thus decrease the global warming potential by 21.2% and 29.2%, respectively, and greenhouse gas emission intensity by 32.0% and 32.5%, respectively, averaged over two seasons. However, the INF + M and INF + M + S treatments showed no significant differences. The INF + M + S treatment provided the highest yields, agronomic efficiency and soil methane uptakes among all treatments (p < 0.05). The nitrous oxide and methane emissions showed significant positive correlations with soil moistures and temperatures, respectively. Meanwhile, both nitrous oxide and carbon dioxide showed significant positive correlations with the soil ammonium and nitrate contents. We highly recommend the INF + M + S treatment as an environmentally friendly fertilization strategy for pineapple in tropical regions with high yields, high efficiencies, and low greenhouse gas emissions.","2022-04-01","2025-08-27 10:53:08","2025-08-27 10:56:31","2022-06-18","","","","343","","J. Cleaner Prod.","","","","","","","","en","","","","WOS:000807372500003","","","50 citations (Crossref/DOI) [2025-08-27]","","","","","","","","","","","","","","","","","","","","","","","","","","","","","","","","","","","","","","","","","","","","","","","","","","",""
"AU95YHAP","journalArticle","2020","Xian, Yuanran; Chen, Yun; Chen, Cheng; He, Rongrong; Chen, Xiaowei; Chen, Yong; Wang, Xiaolong","Does extending recycling chain of using rice straw contribute to improving yield and reducing GHGs emissions in paddy field? An integrated analysis based on field research and system assessment","Journal of Cleaner Production","","0959-6526","10.1016/j.jclepro.2020.121508","","Recycling agriculture is an effective way to reduce greenhouse gases (GHGs) emissions and improve yield of agricultural systems. The core practice of the recycling agriculture model is to extend the industrial chain of agricultural activities and to return the wasted organic materials that resulted from each step of the recycling chain into farmland for completely treating them. In this context, people is asking a question about if the longer recycling chain means the better effectives on yield growth and agricultural GHGs mitigation. For answering the question, therefore, this study compared the yield and net GHGs emissions by applying mineral fertilizer (CK), rice straw (CS), cow manure (CM), biogas residue (BR) and commercial organic fertilizer (MO) into paddy field during 2017-2018 in the South China. All of the organic materials were derived from the different steps of recycling chain of rice straw. The results indicated that the yields of CS, CM, BR and MO were 9.4%, 12.7%, 19.7% and 14.2% higher than CK, respectively. The field-based net GHGs emissions (NGHGD) of CS, CM, BR and MO were 7.2%, 9.7%, 24.1% and 66.4% lower than the CK, respectively. The results demonstrated that, from the farmland level, extending recycling chain of using rice straw indeed contributed to improving yield and reducing GHGs emissions in paddy field. Nevertheless, if the NGHG accounting of different treatments considered the upstream GHGs emissions under the condition of ignoring substituted effects, the longer recycling chain of using rice straw did not contribute to reducing the NGHG of the whole recycling agriculture pathways. Specifically, the system-based net GHGs emission (NGHG) of CS was decreased by 13.0% compared to the CK, while the indices of CM, BR and MO were increased by 96.0%, 14.7% and 26.6%, respectively. The information will contribute to the development of circular economy and clean production in agricultural systems. (C) 2020 Elsevier Ltd. All rights reserved.","2020-08-10","2025-08-27 10:53:08","2025-08-27 10:56:37","2020-06-22","","","","264","","J. Cleaner Prod.","","","","","","","","en","","","","WOS:000538390100005","","","17 citations (Crossref/DOI) [2025-08-27]","","","","","","","","","","","","","","","","","","","","","","","","","","","","","","","","","","","","","","","","","","","","","","","","","","",""
