"73TZYQ8B","journalArticle","2023","He, Xiaoxiang; Dai, Shenyan; Meng, Lei; He, Mengqiu; Wang, Xiaoguo; Cai, Zucong; Zhu, Bo; Zhang, Jinbo; Nardi, Pierfrancesco; Mueller, Christoph","Effects of 18 years repeated N fertilizer applications on gross N transformation rates in a subtropical rain-fed purple soil","Applied Soil Ecology","","0929-1393","10.1016/j.apsoil.2023.104952","","In this study, a 15N tracing experiment was conducted to determine gross N transformation rates in soils with 18 years of repeated N fertilizer applications and to quantify the underlying mechanisms to explain the variability of crop yield in a subtropical rain-fed purple soil. Six N fertilizer treatments were evaluated: unfertilized control (CK), mineral N fertilizer (NPK), pig manure (OM), mineral N fertilizer plus pig manure (OM-NPK), crop residue (RSD) and mineral N fertilizer plus crop residue (RSD-NPK). The results showed that the soil organic carbon (SOC) concentration in OM (average 13.79 g kg-1) and RSD-NPK (average 13.15 g kg-1) were significantly higher than the other treatments (varied from 5.91 to 11.23 g kg -1) after 18 years. Higher maize yields were observed in NPK, OM, OM-NPK, and RSD-NPK, and especially in RSD-NPK and OM-NPK after 18 years, compared with the data measured in the 11th years. Soil gross N mineralization rates (M) were significantly higher in all N fertilizer treatments (varied from 13.00 to 31.17 mg N kg -1 soil d-1) compared to CK (average 5.53 mg N kg -1 soil d-1). After 18 years of repeated N fertilizer applications, M were significantly higher than those in the 11th years for the same N fertilizer treatment, indicating that long-term repeated N fertilizer application, whether mineral N or organic fertilizer, continuously enhances M. M was positively correlated with SOC (p < 0.05) and total N (TN) (p < 0.05), suggesting that soil organic substrates are key factors regulating M. Maize yield was positively correlated with M (p < 0.05), suggesting that available N produced through soil N mineralization played the important role in yield formation. All N fertilizer treatments continuously stimulated gross autotro-phic nitrification rates (ONH4). ONH4 increased with increasing M (p < 0.01) and ammonia-oxidizing bacteria (AOB) abundance (p < 0.05). However, compared to the 11th year, rates of dissimilatory nitrate reduction to ammonium (DNRA) and immobilization of NH4+ (except RSD) and NO3- (except OM-NPK) decreased significantly in the N fertilizer treatments in the 18th year, indicating that N retention capacity is reduced over time and the risk of N losses increased. Considering the best balance among food security, soil C sequestration, and reduction of N leaching, mineral N in combination with straw return (RSD-NPK) can be recommended for regions with similar soils and climates.","2023-09","2025-08-27 10:53:07","2025-08-27 10:56:43","2023-06-29","","","","189","","Appl. Soil Ecol.","","","","","","","","en","","","","WOS:001009381100001","","","14 citations (Crossref/DOI) [2025-08-27]","","","","","","","","","","","","","","","","","","","","","","","","","","","","","","","","","","","","","","","","","","","","","","","","","","",""
"SCW9UHJJ","journalArticle","2022","Hu, Guo-Qing; Ma, Xi-Xian; Li, Xu-Hua; Wang, Hui","Evaluation of organic substitution based on vegetable yield and soil fertility","Environmental Pollutants and Bioavailability","","2639-5932","10.1080/26395940.2022.2064335","","Recultivation of abandoned farmland (AF) is a supplement to land resources. However, less is known about the effects of different organic substitution rates (OSRs) on soil fertility under AF recultivation. We investigated the response of vegetable yields and soil physicochemical and microbial properties to five OSRs (0, 25%, 50%, 75%, and 100%) in an AF. Single chemical fertilizer treatment (0 OSR) had the highest yield (54.4 and 24.8 t hm(-2)) and nitrate content (1118.8 and 341.5 mg kg(-1)) of Chinese cabbage and spinach. With the increase of OSRs, vitamin C content gradually increased in both vegetables. Organic substitution had a positive effect on the main soil fertility indicators. Although 50% and 75% OSRs had not the highest vegetable yield, but they significantly improved vegetable quality and soil fertility. Therefore, it is feasible to increase or maintain soil fertility by organic substitution under AF recultivation.","2022-12-31","2025-08-27 10:53:07","2025-08-27 10:57:03","2022-04-27","162-170","","1","34","","Environ. Pollut. Bioavailability","","","","","","","","en","","","","WOS:000783992200001","","","5 citations (Crossref/DOI) [2025-08-27]","","","","","","","","","","","","","","","","","","","","","","","","","","","","","","","","","","","","","","","","","","","","","","","","","","",""
"CE8PX4BJ","journalArticle","2021","Tang, Yifan; Luo, Liming; Carswell, Alison; Misselbrook, Tom; Shen, Jianhua; Han, Jiangang","Changes in soil organic carbon status and microbial community structure following biogas slurry application in a wheat-rice rotation","Science of the Total Environment","","0048-9697","10.1016/j.scitotenv.2020.143786","","Biogas slurry is widely used as a crop fertilizer due to its available nitrogen content. However, it remains unclear how biogas slurry application affects soil organic carbon (SOC) status and soil microbial community under typical agricultural systems. Here, under a wheat-rice field experiment, we examined the responses of SOC and soil bacterial and fungal communities to biogas slurry application, both with (BSS) and without (BS) straw return, relative to chemical nitrogen fertilizer with (CFS) and without (CF) straw return. The BS treatment significantly increased total organic carbon (TOC) at all soil depths (0-60 cm), compared to CF. Greater TOC occurred at 20-40 cm depth under BSS relative to all other treatments. However, straw return had no impact on soil TOC content under the a and CFS treatments. Labile organic carbon (LOC) in the topsoil and recalcitrant organic carbon (ROC) at 20-60 cm depth was significantly greater under BS relative to CF. The bacterial class Gammaproteobacteria and family Hyphondaobiaceae were found to be specifically abundant under biogas slurry application after one year of wheat-rice double cropping. Network analyses showed that the soil bacterial community under biogas slurry application was more complex than under chemical fertilizer application, while the opposite was true for the fungal community. Correlations between network modules and the SOC fractions indicated that biogas slurry application stimulated soil bacteria and fungi to participate in SOC cycling. The module functionality supports our speculation that soil microorganisms degraded the biogas slurry derived-ROC in the topsoil. Overall, we conclude that substitution of chemical fertilizer with biogas slurry can be beneficial for increasing SOC stocks and, in systems with straw return, enhancing straw decomposition. (C) 2020 Elsevier B.V. All rights reserved.","2021-02-25","2025-08-27 10:53:07","2025-08-27 10:56:27","2021-02-25","","","","757","","Sci. Total Environ.","","","","","","","","en","","","","WOS:000604432900064","","","74 citations (Crossref/DOI) [2025-08-27]","","","","","","","","","","","","","","","","","","","","","","","","","","","","","","","","","","","","","","","","","","","","","","","","","","",""
"5BZWN59J","journalArticle","2019","Geng, Yuhui; Cao, Guojun; Wang, Lichun; Wang, Shuhua","Effects of equal chemical fertilizer substitutions with organic manure on yield, dry matter, and nitrogen uptake of spring maize and soil nitrogen distribution","PLOS One","","1932-6203","10.1371/journal.pone.0219512","","In order to maintain high yields and protect the environment, the replacement of chemical fertilizers with organic ones has received increasing attention in recent years. A 2-year field experiment (2015-2016) was carried out to assess the effects of substituting equal amounts of mineral fertilizer with organic manure on the yield, dry matter (DM), and nitrogen (N) uptake of spring maize (Zea mays L.) and on the mineral N (Nmin) distribution in the soil profile. The treatments included chemical fertilizer; different amounts of maize straw, cow manure, and chicken manure; and an unfertilized control (CK). Compared with the chemical fertilizer treatments, equal amounts of substitutions with cow manure or chicken manure increased production, and a 25% nutrient substitution resulted in the best yield increase. Straw return had no effect on maize production, and 100% straw return resulted in reduced production. The N accumulation and DM content both exhibited a slow-fast-slow growth trend throughout the various growth stages, and the average N uptake and DM accumulation in response to the treatments followed the order of chicken manure > cow manure > chemical fertilizer > straw return > CK. The Nmin content in the profile not only increased as the Nmin application rate increased but also showed greater increases at certain depths than at the surface, indicating that excessive N led to leaching. These results suggest that an appropriate proportion of organic substitution not only provides enough nutrients but also improves the soil environment and leads to increased yields. This technique represents a practical method of continuously increasing production and reducing the risk of N leaching.","2019-07-09","2025-08-27 10:53:07","2025-08-27 10:56:48","2019-09-09","","","7","14","","PLOS One","","","","","","","","en","","","","WOS:000482328300027","","","196 citations (Crossref/DOI) [2025-08-27]","","","","","","","","","","","","","","","","","","","","","","","","","","","","","","","","","","","","","","","","","","","","","","","","","","",""
"9TPGM9IS","journalArticle","2022","Zhang Yin-jie; Gao Wei; Luan Hao-an; Tang Ji-wee; Li Ruo-nan; Li Ming-yue; Zhang Huai-zhi; Huang Shan-wen","Long-term straw addition promotes moderately labile phosphorus formation, decreasing phosphorus downward migration and loss in greenhouse vegetable soil","Journal of Integrative Agriculture","","2095-3119","10.1016/j.jia.2022.07.028","","Phosphorus (P) leaching is a major problem in greenhouse vegetable production with excessive P fertilizer application. Substitution of inorganic P fertilizer with organic fertilizer is considered a potential strategy to reduce leaching, but the effect of organic material addition on soil P transformation and leaching loss remains unclear. The X-ray absorption near-edge structure (XANES) spectroscopy technique can determine P speciation at the molecular level. Here, we integrated XANES and chemical methods to explore P speciation and transformation in a 10-year field experiment with four treatments: 100% chemical fertilizer (4CN), 50% chemical N and 50% manure N (2CN+2MN), 50% chemical N and 50% straw N (2CN+2SN), and 50% chemical N and 25% manure N plus 25% straw N (2CN+2MSN). Compared with the 4CN treatment, the organic substitution treatments increased the content of labile P by 13.7-54.2% in the 0-40 cm soil layers, with newberyite and brushite being the main constituents of the labile P. Organic substitution treatments decreased the stable P content; hydroxyapatite was the main species and showed an increasing trend with increasing soil depth. Straw addition (2CN+2SN and 2CN+2MSN) resulted in a higher moderately labile P content and a lower labile P content in the subsoil (60-100 cm). Moreover, straw addition significantly reduced the concentrations and amounts of total P, dissolved inorganic P (DIP), and particulate P in leachate. DIP was the main form transferred by leaching and co-migrated with dissolved organic carbon. Partial least squares path modeling revealed that straw addition decreased P leaching by decreasing labile P and increasing moderately labile P in the subsoil. Overall, straw addition is beneficial for developing sustainable P management strategies due to increasing labile P in the upper soil layer for the utilization of plants, and decreasing P migration and leaching.","2022","2025-08-27 10:53:07","2025-08-27 10:58:29","2022-09-28","2734-2749","","9","21","","J. Integr. Agric.","","","","","","","","en","","","","WOS:000855976500006","","","10 citations (Crossref/DOI) [2025-08-27]","","","","","","","","","","","","","","","","","","","","","","","","","","","","","","","","","","","","","","","","","","","","","","","","","","",""
"3CT6LABE","journalArticle","2024","Ma, Bao-Luo; Liang, Chang; Gregorich, Edward G.; McLaughlin, Neil B.; Morrison, Malcolm J.; Dwyer, Lianne M.","Nitrogen fertilizer replacement value of stockpiled and rotted dairy cattle manures for corn (zea mays L.) from a long-term study","Field Crops Research","","0378-4290","10.1016/j.fcr.2024.109455","","Context or problem: Animal manure is an excellent renewable source of plant nutrients, but the correct quantification of nutrient equivalents is affected by manure type and application rate as well as weather conditions that impact crop yields Objective or research question: The objectives from a 32-year field experiment were to (1) compare the effects of mineral N fertilization and solid dairy cattle manure on corn grain yield; (2) determine the manure N fertilizer replacement value (NFRV), and (3) quantify environmental factors, mainly the impact of total precipitation during the critical period (silking) on corn yield and manure NFRV. Methods: A field experiment under continuous corn with annual manure application was conducted over 32 years in Ottawa, Ontario, Canada. Corn yield data were categorized into low, intermediate, and high N response groups. Results: On an equivalent amount of manure organic N basis, NFRVs were, on average, 0.38 (+/- 0.02) for stockpiled manure (SM) and 0.27 (+/- 0.02) for incompletely composted or rotted manure (RM), with a wide range of 0.12 (+/- 0.02), 0.28 (+/- 0.02), and 0.37 (+/- 0.04) for RM, and 0.16 (+/- 0.04), 0.39 (+/- 0.03), and 0.48 (+/- 0.04) for SM under the low, intermediate, and high N response conditions, respectively. Supplementing 100 kg synthetic fertilizer N ha-1 in low RM (50 Mg ha-1 fresh weight; f.w.), and 50 kg fertilizer N ha-1 in high RM (100 Mg ha-1 f.w.) application rates decreased NFRVs under low and intermediate N response conditions, whereas the addition of similar synthetic N in the corresponding SM rates reduced NFRVs only under low N response conditions. Conclusions: Based on the 32-year long-term study, we documented that the maximum economic synthetic N fertilizer rates for continuous corn cropping varied from 117 to 179 kg N ha-1 under the low N response, from 127 to 283 kg N ha-1 under the intermediate N response, and from 227 to 289 kg N ha-1 under the high N response conditions. The NFRVs of solid cattle manures varied according to corn yield-N response levels. Implications or significance: Our findings showed that the response of corn yields to manure NFRV depends on the level of yield-N response and climatic conditions. It also indicated the importance of soil organic amendments for improving the climate resilience of corn production, while simultaneously meeting the demand for more sustainable nutrient management of soil resources.","2024-07-01","2025-08-27 10:53:07","2025-08-27 10:57:52","2024-07-14","","","","315","","Field Crops Res.","","","","","","","","en","","","","WOS:001263848400001","","","5 citations (Crossref/DOI) [2025-08-27]","","","","","","","","","","","","","","","","","","","","","","","","","","","","","","","","","","","","","","","","","","","","","","","","","","",""
"SUVWP6PZ","journalArticle","2025","Qu, Mengxue; Chen, Yinglong; Khan, Aziz; Liu, Peng","Enhancing maize yield stability, soil health, and microbial diversity via long-term manure practices: insights from a 14-year trial","Environmental Technology & Innovation","","2352-1864","10.1016/j.eti.2025.104177","","Identifying efficient nutrient management strategies is crucial for maintaining soil health and boosting crop production. A 14-year field experiment with no nitrogen fertilizer (CK), urea with 200 kg N ha-1 (U200), urea with 100 kg N ha-1 (U100), manure with 200 kg N ha-1 (M200), manure with 100 kg N ha-1 (M100), and urea with 100 kg N ha-1 plus manure with 100 kg N ha-1 (U100M100) was conducted to assess the effects on soil quality, microbial diversity and yield sustainability. Long-term fertilization increased the alpha-diversity of bacteria and significantly altered the beta-diversity of both bacteria and fungi. Prolonged fertilization significantly augmented soil nitrogen and phosphorus levels. Concomitantly, the activities of urease, invertase, and alkaline phosphatase were substantially elevated. Compared with U200, M200 and U100M100 raised the soil quality index (SQI) by 27-35 % and 11-24 %, respectively. Long-term manure application increased yield by 42-51 % compared with CK. Furthermore, manure application promoted yield stability (CV) and sustainable yield index (SYI) from 2017 to 2023. Notably, U100M100 improved yield, SYI, and SQI more effectively. SQI significantly correlated with yield, SYI, and CV, suggesting its importance for sustainable production. A partial least squares path model showed that the bacterial community influenced SQI by modulating soil nutrients, and the fungal community impacted SQI by affecting soil enzyme activities. Ultimately, these microbial-mediated effects on SQI influenced crop yield. Overall, substitution of partial mineral fertilizers with manure is a promising strategy for sustainable agricultural production in terms of improving soil health and yield sustainability.","2025-05","2025-08-27 10:53:07","2025-08-27 10:56:58","2025-04-12","","","","38","","Environ. Technol. Innovation","","","","","","","","en","","","","WOS:001460283200001","","","1 citations (Crossref/DOI) [2025-08-27]","","","","","","","","","","","","","","","","","","","","","","","","","","","","","","","","","","","","","","","","","","","","","","","","","","",""
"YUQJXM9H","journalArticle","2024","Chang, Fangdi; Zhang, Hongyuan; Zhao, Na; Zhao, Peiyi; Song, Jiashen; Yu, Ru; Kan, Zhengrong; Wang, Xiquan; Wang, Jing; Liu, Hanjiang; Han, Dongxun; Wen, Xinya; Li, Yuyi","Green manure removal with reduced nitrogen improves saline-alkali soil organic carbon storage in a wheat-green manure cropping system","Science of the Total Environment","","0048-9697","10.1016/j.scitotenv.2024.171827","","The incorporation of green manure into cropping systems is a potential strategy for sequestering soil carbon (C), especially in saline-alkali soil. Yet, there are still unknown about the substitution impacts of green manure on nitrogen (N) fertilizer in wheat-green manure multiple cropping system. Herein, a five-year field experiment was performed to determine the impact of three levels of N fertilizer inputs [i.e., N fertilizer reduced by 0 % (100N), 10 % (90 N), and 20 % (80 N)] with aboveground biomass of green manure removal (0GM) and return (100GM) on soil organic carbon (SOC) storage and its primary determinants. The results demonstrated that no significant interaction on SOC storage was detected between green manure and N fertilizer management. 80 N enhanced SOC storage in bulk soil by 7.4 and 13.2 % in 0 - 20 cm soil depth relative to 100 N and 90 N ( p < 0.05). Regardless of N fertilizer levels, compared with 100GM, 0GM increased SOC storage in bulk soil by 14.2 - 34.6 % in 0 - 40 cm soil depth ( p < 0.05). This was explained by an increase in soil macro -aggregates ( >2 and 0.25 - 2 mm) proportion contributing to SOC physical protection. Meanwhile, the improvement of SOC storage under 0GM was due to the decrease of soil C- and N -acquisition enzyme activities, and microbial resource limitation. Alternatively, the variation partitioning analyses (VPA) results further suggested that C- and N -acquisition enzyme activities, as well as microbial resource limitation were the most important factors for SOC storage. The findings highlighted those biological factors played a dominant role in SOC accumulation compared to physical factors. The aboveground biomass of green manure removal with N fertilizer reduced by 20 % is a viable option to enhance SOC storage in a wheat -green manure multiple cropping system.","2024-05-20","2025-08-27 10:53:07","2025-08-27 10:57:58","2024-05-18","","","","926","","Sci. Total Environ.","","","","","","","","en","","","","WOS:001219165100001","","","14 citations (Crossref/DOI) [2025-08-27]","","","","","","","","","","","","","","","","","","","","","","","","","","","","","","","","","","","","","","","","","","","","","","","","","","",""
"AFJ353ZW","journalArticle","2025","Yao, Zhiyuan; Hu, Huiling; Wang, Tao; Wang, Xiaoguo; Li, Yulong; Sun, Xiaoming; Adl, Sina; Yan, Fangfang; Zhang, Yingjie; Zhu, Bo","Key functional guilds with high trophic level organisms in soil are vital contributors to greenhouse gas emissions from cropland","Agriculture Ecosystems and Environment","","0167-8809","10.1016/j.agee.2024.109441","","Soil microbes drive nutrient cycle and strongly affect the fluxes of greenhouse gases (GHGs) globally. However, the mechanisms through which the key functional guilds regulate GHG fluxes from cropland remain unclear, especially those involving organisms at higher trophic levels of the soil micro-food webs. Therefore, the responses of key functional guilds to fertilization strategies and their contributions to the fluxes of dominant GHG were estimated to improve our mechanistic understanding. Typical fertilization regimes across the country were included in a long-term field experiment: regular synthetic fertilizers (NPK), partial synthetic nitrogen replacement with pig slurry (OMNPK) and crop straw (RSDNPK) plus a nil fertilizer control (Ctrl). The soil was a net sink of CH4, while fertilization treatments increased the fluxes of N2O and CO2. The cumulative N2O and CO2 emissions followed the order of RSDNPK > OMNPK approximate to NPK > Ctrl. Among the three GHGs, CO2 was the dominant one due to its high quantity and showed strong correlations with five soil labile and stable organic carbon and nitrogen fractions. The key functional guilds that strongly correlated with CO2 fluxes at the aggregate scale were composed of not only soil microbes, but also protists (14-19 %) and nematodes (3-4 %). Fertilization with organic amendments (OMNPK and RSDNPK) significantly changed the composition of the key functional guilds, which, along with key soil parameters, explained 26-35 % of the variation in CO2 fluxes. Protists were ranked as the 1st or 2nd most important biological group in determining the composition of the key functional guilds in all aggregate classes. Conclusively, soil biological groups at higher trophic levels, particularly protists, can serve as the important driver of GHG emissions. Manipulating their activities through targeted fertilization offers an alternative to mitigate the climate impacts of crop production.","2025-04-01","2025-08-27 10:53:07","2025-08-27 10:57:32","2025-01-24","","","","381","","Agric. Ecosyst. Environ.","","","","","","","","en","","","","WOS:001398544000001","","","0 citations (Crossref/DOI) [2025-08-27]","","","","","","","","","","","","","","","","","","","","","","","","","","","","","","","","","","","","","","","","","","","","","","","","","","",""
